{
  "$schema": "https://raw.githubusercontent.com/micah1crandell/control-it-modules/main/schemas/module.schema.json",
  "id": "home_assistant",
  "name": "Home Assistant",
  "shortName": "Home Assistant",
  "manufacturer": "Home Assistant",
  "version": "2.0.0",
  "author": "Control It Team",
  "subtitle": "Smart Home, IoT & Studio Relays",
  "descriptionText": "Trigger smart relays, power sockets, studio on-air lights, scene automations, and webhooks via Home Assistant REST / WebSocket API.",
  "iconName": "house.fill",
  "iconColorHex": "#03A9F4",
  "defaultPort": "8123",
  "defaultProtocol": "WEBSOCKET",
  "defaultHost": "192.168.1.200",
  "helpUrl": "https://developers.home-assistant.io/docs/api/rest",
  "origin": "Community",
  "connectionConfig": {
    "protocol": "WEBSOCKET",
    "transport": "WEBSOCKET",
    "defaultPort": "8123",
    "defaultHost": "192.168.1.200",
    "autoConnectOnLaunch": true,
    "setupFields": [
      {
        "id": "host",
        "label": "Home Assistant IP / Domain",
        "type": "Text",
        "defaultValue": "192.168.1.200",
        "placeholder": "192.168.1.200",
        "helpText": "Enter IP address or hostname of your Home Assistant server.",
        "isRequired": true
      },
      {
        "id": "port",
        "label": "Port",
        "type": "Number",
        "defaultValue": "8123",
        "placeholder": "8123",
        "helpText": "Default Home Assistant port is 8123.",
        "isRequired": true
      },
      {
        "id": "token",
        "label": "Long-Lived Access Token",
        "type": "Text",
        "defaultValue": "",
        "placeholder": "Bearer eyJhbGciOi...",
        "helpText": "Generated under Profile > Long-Lived Access Tokens in Home Assistant.",
        "isRequired": false,
        "isSecret": true
      }
    ]
  },
  "variables": [
    {
      "id": "ha_state_switch_studio",
      "name": "Studio Switch State",
      "descriptionText": "State of target entity (on/off)",
      "sampleValue": "on",
      "variableType": "String"
    }
  ],
  "actions": [
    {
      "id": "ha_toggle_light",
      "title": "Home Assistant: Toggle Light / Relay",
      "subtitle": "Switch smart plug or relay",
      "descriptionText": "Toggles the power state of any Home Assistant entity (light, switch, relay).",
      "iconName": "power",
      "iconColorHex": "#0288D1",
      "connectionType": "HTTP",
      "defaultPort": "8123",
      "inputs": [
        {
          "id": "entity_id",
          "label": "Entity ID",
          "type": "Text",
          "defaultValue": "switch.studio_on_air_light",
          "placeholder": "e.g. light.desk, switch.studio_relay"
        }
      ],
      "uri": "/api/services/homeassistant/toggle",
      "httpMethod": "POST",
      "requestBody": "{\"entity_id\": \"{entity_id}\"}",
      "headers": [
        {
          "key": "Content-Type",
          "value": "application/json"
        }
      ]
    },
    {
      "id": "ha_trigger_automation",
      "title": "Home Assistant: Trigger Automation",
      "subtitle": "Run scene or automation routine",
      "descriptionText": "Executes a configured automation routine in Home Assistant.",
      "iconName": "sparkles.rectangle.stack",
      "iconColorHex": "#039BE5",
      "connectionType": "HTTP",
      "defaultPort": "8123",
      "inputs": [
        {
          "id": "automation_id",
          "label": "Automation Entity ID",
          "type": "Text",
          "defaultValue": "automation.studio_stream_mode_on",
          "placeholder": "e.g. automation.studio_stream_mode"
        }
      ],
      "uri": "/api/services/automation/trigger",
      "httpMethod": "POST",
      "requestBody": "{\"entity_id\": \"{automation_id}\"}",
      "headers": [
        {
          "key": "Content-Type",
          "value": "application/json"
        }
      ]
    },
    {
      "id": "ha_get_entity_state",
      "title": "Home Assistant: Get Entity State",
      "subtitle": "Query entity power or sensor state",
      "descriptionText": "Fetches current state of a light, switch, sensor, or binary_sensor from Home Assistant REST API.",
      "iconName": "waveform.path.ecg",
      "iconColorHex": "#03A9F4",
      "connectionType": "HTTP",
      "defaultPort": "8123",
      "inputs": [
        {
          "id": "entity_id",
          "label": "Entity ID",
          "type": "Text",
          "defaultValue": "switch.studio_on_air_light",
          "placeholder": "e.g. light.desk, switch.studio_relay"
        }
      ],
      "uri": "/api/states/{entity_id}",
      "httpMethod": "GET",
      "headers": [
        {
          "key": "Accept",
          "value": "application/json"
        }
      ],
      "dynamicTitleParsingRule": "{entity_id}",
      "dynamicColorRules": [
        {
          "id": "c1",
          "condition": "{{ha_state_{entity_id}}} == on",
          "colorName": "Yellow"
        },
        {
          "id": "c2",
          "condition": "{{ha_state_{entity_id}}} == off",
          "colorName": "Default"
        }
      ]
    }
  ],
  "driverScript": "module.exports = {\n    msgId: 1,\n    onConnect: function(transport, config) {\n        engine.setStatus(\"connecting\", \"Connecting to Home Assistant WebSocket...\");\n    },\n    onTransportReady: function(transport, config) {\n        engine.setStatus(\"authenticating\", \"Authenticating with Access Token...\");\n    },\n    onAction: function(transport, actionId, params) {\n        if (actionId === \"ha_get_entity_state\" || actionId === \"get_entity_state\" || actionId === \"get_state\") {\n            var entityId = params.entity_id || \"switch.studio_on_air_light\";\n            var cleanEntity = entityId.replace(/\\./g, \"_\");\n            var st = engine.getVariable(\"ha_\" + cleanEntity + \"_state\") || \"unknown\";\n            return \"Entity \" + entityId + \" state: \" + st;\n        }\n        var domain = params.domain || \"light\";\n        var service = params.service || \"toggle\";\n        var entityId = params.entity_id || \"\";\n        \n        var payload = {\n            id: ++this.msgId,\n            type: \"call_service\",\n            domain: domain,\n            service: service,\n            service_data: {}\n        };\n        if (entityId) {\n            payload.service_data.entity_id = entityId;\n        }\n        transport.sendJSON(payload);\n        return \"Called \" + domain + \".\" + service + (entityId ? \" on \" + entityId : \"\");\n    },\n    onMessage: function(transport, text, bytes) {\n        var msg;\n        try { msg = JSON.parse(text); } catch(e) { return; }\n        \n        if (msg.type === \"auth_required\") {\n            var token = engine.secret(\"access_token\") || engine.secret(\"token\") || \"\";\n            transport.sendJSON({\n                type: \"auth\",\n                access_token: token\n            });\n            return;\n        }\n        \n        if (msg.type === \"auth_ok\") {\n            engine.setStatus(\"connected\", \"Home Assistant Connected\");\n            transport.sendJSON({\n                id: ++this.msgId,\n                type: \"subscribe_events\",\n                event_type: \"state_changed\"\n            });\n            return;\n        }\n        \n        if (msg.type === \"auth_invalid\") {\n            engine.setStatus(\"failed\", \"Authentication Failed: \" + (msg.message || \"Invalid Token\"));\n            return;\n        }\n        \n        if (msg.type === \"event\" && msg.event && msg.event.event_type === \"state_changed\") {\n            var data = msg.event.data;\n            if (data && data.entity_id && data.new_state) {\n                var cleanEntity = data.entity_id.replace(/\\./g, \"_\");\n                engine.setVariable(\"ha_\" + cleanEntity + \"_state\", String(data.new_state.state));\n            }\n        }\n    }\n};"
}